人,"man/person/people/CL:個|个[ge4],位[wei4]",人,人: man,rén,level1
刷,to brush/to paint/to daub/to paste up/to skip class (of students)/to fire from a job,刷,"尸: corpse, 巾: turban, 刂: knife",shuā,level103
岗,mound/policeman's beat,崗,"山: mountain, 冂: down box, 乂: unknown",gǎng,level103
逸,to escape/leisurely/outstanding,逸,"辶: walk, ⺈: unknown, 口: mouth, 丨: line, 乚: second, 丶: dot",yì,level103
傲,proud/arrogant/to despise/unyielding/to defy,傲,"亻: man, 龶: unknown, 一: one, 丿: slash, ㇆: unknown, ⺙: unknown",ào,level103
厨,kitchen,廚,"厂: cliff, 豆: bean, 寸: inch",chú,level103
挣,struggle,掙,"扌: hand, ⺈: unknown, ⺕: unknown, 亅: hook",zhèng,level103
颠,top (of the head)/apex/to fall forwards/inverted/to jolt,顛,"十: ten, 目: eye, 一: one, 八: eight, 页: leaf",diān,level103
寓,to reside/to imply/to contain/residence,寓,"宀: roof, 冂: down box, 二: two, 丨: line, 禸: track",yù,level103
挖,to dig/to excavate/to scoop out,挖,"扌: hand, 穴: cave, ㇠: unknown",wā,level103
蜂,bee/wasp,蜂,"虫: insect, 夂: go, 一: one, 二: two, 丨: line",fēng,level103
顽,mischievous/obstinate/to play/stupid/stubborn/naughty,頑,"二: two, 儿: son, legs, 页: leaf",wán,level103
啥,dialectal equivalent of 什麼|什么[shen2 me5],啥,"口: mouth, 人: man, 干: dry, 口: mouth",shá,level103
渠,surname Qu,渠,"氵: water, 匚: right open box, No glyph available: unknown, 木: tree",qú,level103
牺,sacrifice,犧,"牛: cow, 西: west",xī,level103
祇,but/only,祇,"礻: spirit, 氏: clan",zhǐ,level103
翔,to soar/to glide/also used in place of 詳|详[xiang2] detailed,翔,"羊: sheep, 羽: feather",xiáng,level104
窝,nest/pit or hollow on the human body/lair/den/place/to harbor or shelter/to hold in check/to bend/classifier for litters and broods,窩,"穴: cave, 口: mouth, 人: man, 冂: down box",wō,level104
址,location/site,址,"土: earth, 止: stop",zhǐ,level104
挡,to resist/to obstruct/to hinder/to keep off/to block (a blow)/to get in the way of/cover/gear,擋,"扌: hand, ⺌: small, 彐: snout",dǎng,level104
肆,four (banker's anti-fraud numeral)/market,肆,"镸: unknown, 聿: brush",sì,level104
悠,long or drawn out/remote in time or space/leisurely/to swing/pensive/worried,悠,"亻: man, 丨: line, ⺙: unknown, 心: heart",yōu,level104
昼,daytime,晝,"尸: corpse, ㇏: unknown, 日: sun, 一: one",zhòu,level104
饱,to eat till full/satisfied,飽,"饣: eat, 勹: wrap, 巳: unknown",bǎo,level104
臭,stench/stink/smelly/to smell (bad),臭,"自: self, 犬: dog",chòu,level104
艳,colorful/splendid/gaudy/amorous/romantic/to envy,艷,"一: one, 二: two, 丨: line, 色: color",yàn,level104
骄,proud/arrogant,驕,"马: horse, ㇒: unknown, 大: big, No glyph available: unknown",jiāo,level104
灌,to irrigate/to pour/to install (software)/to record (music),灌,"氵: water, 艹: grass, 吅: unknown, 隹: short-tailed bird",guàn,level104
娃,baby/doll,娃,"女: woman, 圭: unknown",wá,level104
寝,to lie down,寢,"宀: roof, 丬: half tree trunk, 彐: snout, 冖: cover, 又: again",qǐn,level104
坠,to fall/to drop/to weigh down,墜,"阝: mound, 人: man, 土: earth",zhuì,level104
剥,to peel/to skin/to shell/to shuck,剝,"彐: snout, 氺: water, 刂: knife",bāo,level104
睁,to open (one's eyes),睜,"目: eye, ⺈: unknown, ⺕: unknown, 亅: hook",zhēng,level104
腔,cavity of body/barrel (e.g. engine cylinder)/compartment/tune/accent of speech,腔,"月: moon, 穴: cave, 工: work",qiāng,level104
廊,corridor/veranda/porch,廊,"广: dotted cliff, 丨: line, 彐: snout, 乚: second, 丶: dot, 丶: dot, 阝: mound",láng,level104
涛,big wave,濤,"氵: water, 一: one, 二: two, 丨: line, 寸: inch",tāo,level104
纾,abundant/ample/at ease/relaxed/to free from/to relieve,紓,"纟: silk, 龴: ma, ㇖: unknown, 亅: hook",shū,level104
罩,cover/fish trap (basket)/shade,罩,"罒: net, ⺊: unknown, 日: sun, 十: ten",zhào,level105
盆,"basin/flower pot/unit of volume equal to 12 斗 and 8 升, approx 128 liters/CL:個|个[ge4]",盆,"八: eight, 刀: knife, 皿: dish",pén,level105
衍,to spread out/to develop/to overflow/to amplify,衍,"行: walk enclosure, 氵: water",yǎn,level105
扔,to throw/to throw away,扔,"扌: hand, ㇎: unknown, 丿: slash",rēng,level105
璃,colored glaze/glass,璃,"王: jade, 亠: lid, 凵: open box, 乂: unknown, 禸: track",lí,level105
帘,hanging screen or curtain,簾,"穴: cave, 巾: turban",lián,level105
烛,candle/(literary) to illuminate,燭,"火: fire, 虫: insect",zhú,level105
赌,to bet/to gamble,賭,"贝: shell, 耂: old, 日: sun",dǔ,level105
凑,"to gather together, pool or collect/to happen by chance/to move close to/to exploit an opportunity",湊,"冫: ice, 一: one, 二: two, 丨: line, 八: eight, ㇒: unknown, 大: big",còu,level105
菩,Bodhisattva,菩,"艹: grass, 立: stand, 口: mouth",pú,level105
媳,daughter in law,媳,"女: woman, 自: self, 心: heart",xí,level105
眠,sleep,眠,"目: eye, 巳: unknown, ㇂: unknown, 一: one",mián,level105
俘,to take prisoner/prisoner of war,俘,"亻: man, 爫: claw, 子: child",fú,level105
钩,to hook/to sew/to crochet/hook/check mark or tick/window catch,鉤,"钅: gold, 勹: wrap, 厶: private",gōu,level105
绵,silk floss/continuous/soft/weak/mild-mannered (topolect),綿,"纟: silk, 白: white, 巾: turban",mián,level105
袍,gown (lined),袍,"衤: clothes, 勹: wrap, 巳: unknown",páo,level105
癌,cancer/carcinoma/also pr. [yan2],癌,"疒: sickness, 品: unknown, 山: mountain",ái,level105
耸,to excite/to raise up/to shrug/high/lofty/towering,聳,"从: unknown, 耳: ear",sǒng,level105
狭,narrow/narrow-minded,狹,"犭: dog, 人: man, 二: two, 丷: horns",xiá,level105
诈,to cheat/to swindle/to pretend/to feign/to draw sb out/to try to extract information by deceit or bluff,詐,"讠: speech, 丿: slash, 一: one, 丨: line, 二: two",zhà,level105
樑,variant of 梁[liang2],樑,"木: tree, 氵: water, 刀: knife, 八: eight, 木: tree",liáng,level105
驳,variegated/heterogeneous/to refute/to contradict/to ship by barge/a barge/a lighter (ship),駁,"马: horse, 爻: double x",bó,level106
遮,to cover up (a shortcoming)/to screen off/to hide/to conceal,遮,"辶: walk, 广: dotted cliff, 廿: unknown, 灬: fire",zhē,level106
蓄,to store up/to grow (e.g. a beard)/to entertain (ideas),蓄,"艹: grass, 玄: profound, 田: field",xù,level106
樱,cherry,櫻,"木: tree, No glyph available: unknown, 女: woman",yīng,level106
衫,garment/jacket with open slits in place of sleeves,衫,"衤: clothes, 彡: bristle",shān,level106
挨,in order/in sequence/close to/adjacent to,挨,"扌: hand, 厶: private, 矢: arrow",āi,level106
拆,to tear open/to tear down/to tear apart/to open,拆,"扌: hand, 斤: axe, 丶: dot",chāi,level106
纤,fine/delicate/minute,纖,"纟: silk, ㇒: unknown, 十: ten",xiān,level106
砍,to chop/to cut down/to throw sth at sb,砍,"石: stone, 欠: lack",kǎn,level106
胎,fetus/litter/tire/abbr. of 輪胎|轮胎,胎,"月: moon, 厶: private, 口: mouth",tāi,level106
柜,cupboard/cabinet/wardrobe,櫃,"木: tree, 匚: right open box, No glyph available: unknown",guì,level106
壳,shell/carapace/crust (earth's crust etc)/also pr. [ke2],殼,"士: scholar, 冖: cover, 几: table",ké,level106
擅,without authority/to usurp/to arrogate to oneself/to monopolize/expert in/to be good at,擅,"扌: hand, 亠: lid, 回: unknown, 日: sun, 一: one",shàn,level106
铭,to engrave/inscribed motto,銘,"钅: gold, 夕: evening, 口: mouth",míng,level106
铃,(small) bell/CL:隻|只[zhi1],鈴,"钅: gold, 人: man, 丶: dot, 龴: ma",líng,level106
嘱,to enjoin/to implore/to urge,囑,"口: mouth, 尸: corpse, ㇒: unknown, 虫: insect, 冂: down box",zhǔ,level106
糟,dregs/draff/pickled in wine/rotten/messy/ruined,糟,"米: rice, 艹: grass, No glyph available: unknown, 二: two, 凵: open box, 日: sun",zāo,level106
棋,chess/CL:盤|盘[pan2],棋,"木: tree, 甘: sweet, 一: one, 八: eight",qí,level106
尿,to urinate/urine/CL:泡[pao1],尿,"尸: corpse, 水: water",niào,level106
杭,surname Hang/Hangzhou,杭,"木: tree, 亠: lid, 几: table",háng,level106
埔,port/wharf/pier,埔,"土: earth, 十: ten, 用: use, 丶: dot",pǔ,level106
愧,ashamed,愧,"忄: heart, 鬼: ghost",kuì,level107
饲,to raise/to rear/to feed,飼,"饣: eat, ㇆: unknown, 一: one, 口: mouth",sì,level107
贬,to diminish/to demote/to reduce or devaluate/to disparage/to censure/to depreciate,貶,"贝: shell, ㇒: unknown, 王: jade, 丶: dot, 戈: halberd, ㇝: unknown",biǎn,level107
衷,inner feelings,衷,"衣: clothes, 口: mouth, 丨: line",zhōng,level107
颤,to tremble/to shiver/to shake/to vibrate/Taiwan pr. [zhan4],顫,"亠: lid, 回: unknown, 日: sun, 一: one, 页: leaf",chàn,level107
俯,to look down/to stoop,俯,"亻: man, 广: dotted cliff, 亻: man, 寸: inch",fǔ,level107
骤,sudden/unexpected/abrupt/suddenly/Taiwan pr. [zou4],驟,"马: horse, 耳: ear, 又: again, 乑: unknown",zhòu,level107
逮,to catch/to seize/until/colloquial pr. [dai3],逮,"辶: walk, 隶: slave",dài,level107
逾,to exceed/to go beyond/to transcend/to cross over/to jump over,逾,"辶: walk, 人: man, 一: one, 月: moon, 刂: knife",yú,level107
捧,to clasp/to cup the hands/to hold up with both hands/to offer (esp. in cupped hands)/to praise/to flatter,捧,"扌: hand, 一: one, 二: two, 丨: line, 八: eight, 二: two, 丨: line",pěng,level107
畅,free/unimpeded/smooth/at ease/free from worry/fluent,暢,"日: sun, 丨: line, ㇎: unknown, No glyph available: unknown",chàng,level107
喘,to gasp/to pant/asthma,喘,"口: mouth, 山: mountain, 而: and",chuǎn,level107
矩,carpenter's square/rule/regulation/pattern/to carve,矩,"矢: arrow, 匚: right open box, No glyph available: unknown",jǔ,level107
坊,surname Fang,坊,"土: earth, 方: square",fāng,level107
棍,stick/rod/truncheon,棍,"木: tree, 日: sun, 比: compare",gùn,level107
抹,to wipe,抹,"扌: hand, 木: tree, 一: one",mǒ,level107
杆,stick/pole/lever/classifier for long objects such as guns,桿,"木: tree, 干: dry",gān,level107
膀,upper arm/wing,膀,"月: moon, 亠: lid, 丷: horns, 冖: cover, 方: square",bǎng,level107
皱,to wrinkle/wrinkled/to crease,皺,"⺈: unknown, 彐: snout, 皮: skin",zhòu,level107
爽,bright/clear/crisp/open/frank/straightforward/to feel well/fine/pleasurable/invigorating/to deviate,爽,"大: big, 㸚: unknown",shuǎng,level107
聆,apprehend/hear/listen,聆,"耳: ear, 人: man, 丶: dot, 龴: ma",líng,level107
氧,oxygen (chemistry),氧,"气: steam, 羊: sheep",yǎng,level108
谊,friendship/also pr. [yi2],誼,"讠: speech, 宀: roof, 月: moon, 一: one",yì,level108
栏,fence/railing/hurdle/column or box (of text or other data),欄,"木: tree, 丷: horns, 一: one, 二: two",lán,level108
盒,small box/case,盒,"人: man, 一: one, 口: mouth, 皿: dish",hé,level108
孕,pregnant,孕,"㇎: unknown, 丿: slash, 子: child",yùn,level108
躬,body/oneself/personally/to bow,躬,"身: body, 弓: bow",gōng,level108
摘,"to take/to borrow/to pick (flowers, fruit etc)/to pluck/to select/to remove/to take off (glasses, hat etc)",摘,"扌: hand, 亠: lid, 丷: horns, 欠: lack, 子: child",zhāi,level108
哼,to groan/to snort/to hum/to croon/humph!,哼,"口: mouth, 亠: lid, 口: mouth, ㇇: unknown, 亅: hook",hēng,level108
诵,to read aloud/to recite,誦,"讠: speech, 龴: ma, 用: use",sòng,level108
滩,beach/shoal/CL:片[pian4],灘,"氵: water, 又: again, 隹: short-tailed bird",tān,level108
钞,"money/paper money/variant of 抄, to copy",鈔,"钅: gold, 小: small, 丿: slash",chāo,level108
傻,foolish,傻,"亻: man, 囗: enclosure, 丶: dot, 乂: unknown, 八: eight, 夂: go",shǎ,level108
塘,dyke/embankment/pool or pond/hot-water bathing pool,塘,"土: earth, 广: dotted cliff, ⺺: unknown, 口: mouth",táng,level108
薪,fuel/salary,薪,"艹: grass, 立: stand, 十: ten, 小: small, 斤: axe",xīn,level108
碑,"a monument/an upright stone tablet/stele/CL:塊|块[kuai4],面[mian4]",碑,"石: stone, 冂: down box, 二: two, 丨: line, 丶: dot, 十: ten",bēi,level108
挽,to pull/to draw (a cart or a bow)/to lead (an animal)/an elegy (for use in funeral procession)/to turn (change direction)/to roll up (a scroll)/to coil,挽,"扌: hand, ⺈: unknown, 口: mouth, 丨: line, 乚: second",wǎn,level108
堤,variant of 堤[di1],隄,"土: earth, 日: sun, 一: one, 龰: unknown",dī,level108
坟,grave/tomb/CL:座[zuo4]/embankment/mound/ancient book,墳,"土: earth, 文: script",fén,level108
喂,to feed,餵,"口: mouth, 田: field, 一: one, 乚: second, No glyph available: unknown",wèi,level108
妆,(of a woman) to adorn oneself/makeup/adornment/trousseau/stage makeup and costume,妝,"丬: half tree trunk, 女: woman",zhuāng,level108
卅,thirty,卅,"川: river, 一: one",sà,level108
枯,dried up,枯,"木: tree, 十: ten, 口: mouth",kū,level109
眨,to blink/to wink,眨,"目: eye, ㇒: unknown, 王: jade, 丶: dot, 戈: halberd, ㇝: unknown",zhǎ,level109
盯,to watch attentively/to fix attention on/to stare/to gaze/to follow/to shadow sb,盯,"目: eye, 一: one, 亅: hook",dīng,level109
颈,neck,頸,"龴: ma, 工: work, 页: leaf",jǐng,level109
盼,to hope for/to long for/to expect,盼,"目: eye, 八: eight, 刀: knife",pàn,level109
棒,stick/club/cudgel/smart/capable/strong/wonderful/classifier for legs of a relay race,棒,"木: tree, 一: one, 二: two, 丨: line, 八: eight, 二: two, 丨: line",bàng,level109
嚷,to blurt out/to shout,嚷,"口: mouth, 衣: clothes, 吅: unknown, No glyph available: unknown, 二: two, 一: one",rǎng,level109
愉,pleased,愉,"忄: heart, 人: man, 一: one, 月: moon, 刂: knife",yú,level109
肺,lung/CL:個|个[ge4],肺,"月: moon, 十: ten, 巾: turban",fèi,level109
棉,generic term for cotton or kapok/cotton/padded or quilted with cotton,棉,"木: tree, 白: white, 巾: turban",mián,level109
隙,crack/crevice/gap or interval/loophole/discord/rift,隙,"阝: mound, 小: small, 日: sun, 小: small",xì,level109
霜,frost/white powder or cream spread over a surface/frosting/(skin) cream,霜,"雨: rain, 木: tree, 目: eye",shuāng,level109
坑,hole/pit/tunnel/to defraud,坑,"土: earth, 亠: lid, 几: table",kēng,level109
煌,brilliant,煌,"火: fire, 白: white, 王: jade",huáng,level109
崖,precipice/cliff/Taiwan pr. [yai2],崖,"山: mountain, 厂: cliff, 圭: unknown",yá,level109
浴,bath/to bathe,浴,"氵: water, 谷: valley",yù,level109
裤,underpants/trousers/pants,褲,"衤: clothes, 广: dotted cliff, 车: cart",kù,level109
苹,marsiliaceae/clover fern,蘋,"艹: grass, 干: dry, 丷: horns",píng,level109
惹,to provoke/to irritate/to vex/to stir up/to anger/to attract (troubles)/to cause (problems),惹,"艹: grass, 𠂇: unknown, 口: mouth, 心: heart",rě,level109
吻,kiss/to kiss/mouth,吻,"口: mouth, 勹: wrap, No glyph available: unknown",wěn,level109
蟑,cockroach,蟑,"虫: insect, 立: stand, 日: sun, 十: ten",zhāng,level109
氛,miasma/vapor,氛,"气: steam, 八: eight, 刀: knife",fēn,level110
吵,to quarrel/to make a noise/noisy/to disturb by making a noise,吵,"口: mouth, 小: small, 丿: slash",chǎo,level110
恳,earnest,懇,"艮: stopping, 心: heart",kěn,level110
捐,to contribute/to donate/contribution/tax/to abandon,捐,"扌: hand, 口: mouth, 月: moon",juān,level110
闯,to rush/to charge/to dash/to break through/to temper oneself (through battling hardships),闖,"门: gate, 马: horse",chuǎng,level110
翅,wing,翅,"支: branch, 羽: feather",chì,level110
懒,lazy,懶,"忄: heart, 木: tree, 口: mouth, ⺈: unknown, 贝: shell",lǎn,level110
胶,to glue/glue/gum/rubber,膠,"月: moon, 亠: lid, 八: eight, 乂: unknown",jiāo,level110
膜,membrane/film,膜,"月: moon, 艹: grass, 日: sun, 大: big",mó,level110
祈,to implore/to pray/to request,祈,"礻: spirit, 斤: axe",qí,level110
蜜,honey,蜜,"宀: roof, 心: heart, 丿: slash, 虫: insect",mì,level110
募,canvass for contributions/to recruit/to collect/to raise,募,"艹: grass, 日: sun, 大: big, 力: power",mù,level110
慨,generous/sad,慨,"忄: heart, 丨: line, 彐: snout, 乚: second, 丶: dot, 旡: not",kǎi,level110
冻,to freeze/to feel very cold/aspic or jelly,凍,"冫: ice, 乚: second, 一: one, 小: small",dòng,level110
喉,"appears as phonetic ho, especially in words taken from Sanskrit",睺,"口: mouth, 亻: man, No glyph available: unknown, 矢: arrow",hóu,level110
泡,puffed/swollen/spongy/small lake (esp. in place names)/classifier for urine or feces,泡,"氵: water, 勹: wrap, 巳: unknown",pào,level110
鄙,rustic/low/base/mean/to despise/to scorn,鄙,"口: mouth, 十: ten, 回: unknown, 阝: mound",bǐ,level110
亩,classifier for fields/unit of area equal to one fifteenth of a hectare,畝,"亠: lid, 田: field",mǔ,level110
脆,brittle/fragile/crisp/crunchy/clear and loud voice/neat,脆,"月: moon, ⺈: unknown, 厂: cliff, 乚: second, ㇆: unknown",cuì,level110
洒,to sprinkle/to spray/to spill/to shed,灑,"氵: water, 西: west",sǎ,level110
螂,dragonfly/mantis,螂,"虫: insect, 丨: line, 彐: snout, 乚: second, 丶: dot, 丶: dot, 阝: mound",láng,level110
喻,surname Yu,喻,"口: mouth, 人: man, 一: one, 月: moon, 刂: knife",yù,level111
瞪,to open (one's eyes) wide/to stare at/to glare at,瞪,"目: eye, 癶: dotted tent, legs, 豆: bean",dèng,level111
甜,sweet,甜,"舌: tongue, 甘: sweet",tián,level111
雀,a freckle/lentigo,雀,"小: small, 丿: slash, 隹: short-tailed bird",què,level111
炭,wood charcoal/coal/carbon,炭,"山: mountain, 𠂇: unknown, 火: fire",tàn,level111
斑,spot/colored patch/stripe/spotted/striped/variegated,斑,"玨: unknown, 文: script",bān,level111
拐,to turn/to kidnap (esp. through trickery)/to shanghai/a cane,拐,"扌: hand, 口: mouth, 力: power",guǎi,level111
矮,low/short (in length),矮,"矢: arrow, 禾: grain, 女: woman",ǎi,level111
滥,overflowing/excessive/indiscriminate,濫,"氵: water, 丨: line, 丨: line, 丿: slash, 一: one, 丶: dot, 皿: dish",làn,level111
筒,tube/cylinder,筒,"⺮: bamboo, 冂: down box, 一: one, 口: mouth",tǒng,level111
秃,bald/blunt,禿,"禾: grain, 几: table",tū,level111
蓬,surname Peng,蓬,"艹: grass, 辶: walk, 夂: go, 一: one, 二: two, 丨: line",péng,level111
硕,large/big,碩,"石: stone, 页: leaf",shuò,level111
瞬,to wink,瞬,"目: eye, 爫: claw, 冖: cover, 舛: oppose",shùn,level111
锅,"pot/pan/boiler/CL:口[kou3],隻|只[zhi1]",鍋,"钅: gold, 口: mouth, 人: man, 冂: down box",guō,level111
叠,to fold/to fold over in layers/to furl/to layer/to pile up/to repeat/to duplicate,疊,"叒: unknown, 冖: cover, 月: moon, 一: one",dié,level111
帖,fitting snugly/appropriate/suitable/to paste (same as 貼|贴[tie1])/to obey (same as 貼|贴[tie1]),帖,"巾: turban, ⺊: unknown, 口: mouth",tiè,level111
壶,pot/classifier for bottled liquid,壺,"士: scholar, 冖: cover, No glyph available: unknown, 丷: horns, 一: one",hú,level111
纱,cotton yarn/muslin,紗,"纟: silk, 小: small, 丿: slash",shā,level111
垒,rampart/base (in baseball),壘,"厽: unknown, 土: earth",lěi,level111
唢,see 嗩吶|唢呐[suo3 na4],嗩,"口: mouth, ⺌: small, 贝: shell",suǒ,level111
摧,to break/to destroy/to devastate/to ravage/to repress,摧,"扌: hand, 山: mountain, 隹: short-tailed bird",cuī,level112
虹,rainbow,虹,"虫: insect, 工: work",hóng,level112
枕,pillow/to pillow/to rest one's head,枕,"木: tree, 巾: turban, 乚: second",zhěn,level112
俭,frugal/thrifty/needy,儉,"亻: man, 人: man, 一: one, ⺍: small, 一: one",jiǎn,level112
蝶,butterfly/CL:隻|只[zhi1],蝶,"虫: insect, ㇗: unknown, 廿: unknown, 木: tree",dié,level112
剪,surname Jian,剪,"丷: horns, 一: one, 月: moon, 刂: knife, 刀: knife",jiǎn,level112
凄,intense cold/frigid/dismal/grim/bleak/sad/mournful,淒,"冫: ice, 十: ten, ⺺: unknown, 女: woman",qī,level112
颂,ode/eulogy/to praise in writing/to wish (in letters),頌,"八: eight, 厶: private, 页: leaf",sòng,level112
逝,(of time) to pass/to die,逝,"辶: walk, 扌: hand, 斤: axe",shì,level112
讶,astounded,訝,"讠: speech, 牙: fang",yà,level112
掘,dig,掘,"扌: hand, 尸: corpse, 出: unknown",jué,level112
昧,conceal/dark,昧,"日: sun, 木: tree, 一: one",mèi,level112
猴,monkey/CL:隻|只[zhi1],猴,"犭: dog, 亻: man, No glyph available: unknown, 矢: arrow",hóu,level112
澄,surname Cheng,澄,"氵: water, 癶: dotted tent, legs, 豆: bean",chéng,level112
塑,to model (a figure) in clay,塑,"丷: horns, 一: one, 屮: sprout, 月: moon, 土: earth",sù,level112
吁,to implore,籲,"口: mouth, 干: dry, 亅: hook",xū,level112
脂,fat/rouge (cosmetics)/resin,脂,"月: moon, 匕: spoon, 日: sun",zhī,level112
伺,to wait on,伺,"亻: man, ㇆: unknown, 一: one, 口: mouth",sì,level112
滞,sluggish,滯,"氵: water, 川: river, 一: one, 冖: cover, 巾: turban",zhì,level112
漆,paint/lacquer/CL:道[dao4],漆,"氵: water, 木: tree, 人: man, 氺: water",qī,level112
呐,battle cry,吶,"口: mouth, 人: man, 冂: down box",nà,level112
乖,"(of a child) obedient, well-behaved/clever/shrewd/alert/perverse/contrary to reason/irregular/abnormal",乖,"㇒: unknown, 十: ten, 北: unknown",guāi,level113
旺,prosperous/flourishing/(of flowers) blooming/(of fire) roaring,旺,"日: sun, 王: jade",wàng,level113
傍,"near/approaching/to depend on/(slang) to have an intimate relationship with sb/Taiwan pr. [pang2], [bang1], [bang4]",傍,"亻: man, 亠: lid, 丷: horns, 冖: cover, 方: square",bàng,level113
鸭,duck/CL:隻|只[zhi1]/male prostitute (slang),鴨,"冂: down box, 二: two, 丨: line, 鸟: bird",yā,level113
倦,tired,倦,"亻: man, 二: two, 丨: line, 丷: horns, 八: eight, 乚: second, ㇆: unknown",juàn,level113
铸,to cast or found metals,鑄,"钅: gold, 一: one, 二: two, 丨: line, 寸: inch",zhù,level113
膝,knee,膝,"月: moon, 木: tree, 人: man, 氺: water",xī,level113
颁,to promulgate/to send out/to issue/to grant or confer,頒,"八: eight, 刀: knife, 页: leaf",bān,level113
歧,divergent/side road,歧,"止: stop, 支: branch",qí,level113
攀,to climb (by pulling oneself up)/to implicate/to claim connections of higher status,攀,"林: unknown, 爻: double x, 大: big, 手: hand",pān,level113
谎,lies/to lie,謊,"讠: speech, 艹: grass, 匸: hiding enclosure, 丶: dot, 儿: son, legs, 丨: line",huǎng,level113
棵,"classifier for trees, cabbages, plants etc",棵,"木: tree, 田: field, 木: tree",kē,level113
瞒,to conceal from/to keep (sb) in the dark,瞞,"目: eye, 艹: grass, 一: one, 从: unknown, 冂: down box",mán,level113
谐,harmonious,諧,"讠: speech, 比: compare, 白: white",xié,level113
颖,surname Ying,穎,"匕: spoon, 禾: grain, 页: leaf",yǐng,level113
倡,to initiate/to instigate/to introduce/to lead,倡,"亻: man, 昌: unknown",chàng,level113
峻,(of mountains) high/harsh or severe,峻,"山: mountain, 厶: private, 八: eight, 夂: go",jùn,level113
链,chain/lead or tin ore,鏈,"钅: gold, 辶: walk, 车: cart",liàn,level113
歉,to apologize/to regret/deficient,歉,"丷: horns, 一: one, No glyph available: unknown, 八: eight, ⺕: unknown, 欠: lack",qiàn,level113
奠,to fix/to settle/a libation to the dead,奠,"丷: horns, 酉: wine, 大: big",diàn,level113
豚,suckling pig,豚,"月: moon, 豕: pig",tún,level113
骚,trouble/disturbance/rumpus/flirty/coquettish/abbr. for 離騷|离骚[Li2 Sao1]/literary writings/smell of urine/foul smell/male (animal) (topolect),騷,"马: horse, 又: again, 丶: dot, 虫: insect",sāo,level114
厢,box (in theater)/side room/side,廂,"厂: cliff, 木: tree, 目: eye",xiāng,level114
栽,to grow/to plant/to insert/to force on sb/to fall head first,栽,"土: earth, 戈: halberd, 木: tree",zāi,level114
溢,to overflow,溢,"氵: water, 丷: horns, 一: one, 八: eight, 皿: dish",yì,level114
谱,chart/list/table/register/score (music)/spectrum (physics),譜,"讠: speech, 丷: horns, 一: one, No glyph available: unknown, 丷: horns, 一: one, 日: sun",pǔ,level114
裹,to bind/to wrap/a bundle/a parcel,裹,"衣: clothes, 田: field, 木: tree",guǒ,level114
陌,raised path/street,陌,"阝: mound, 一: one, 白: white",mò,level114
裳,lower garment/skirts/petticoats/garments,裳,"⺌: small, 冖: cover, 口: mouth, 衣: clothes",cháng,level114
缚,to bind/to tie/Taiwan pr. [fu2],縛,"纟: silk, 十: ten, 用: use, 丶: dot, 寸: inch",fù,level114
胀,dropsical/swollen/to swell/to be bloated,脹,"月: moon, 长: long",zhàng,level114
榜,to row/oar/Taiwan pr. [beng4],榜,"木: tree, 亠: lid, 丷: horns, 冖: cover, 方: square",bǎng,level114
裙,skirt/CL:條|条[tiao2],裙,"衤: clothes, ⺕: unknown, 丨: line, 口: mouth",qún,level114
赚,to earn/to make a profit,賺,"贝: shell, 丷: horns, 一: one, No glyph available: unknown, 八: eight, ⺕: unknown",zhuàn,level114
厘,"Li (c. 2000 BC), sixth of the legendary Flame Emperors 炎帝[Yan2 di4] descended from Shennong 神農|神农[Shen2 nong2] Farmer God, also known as Ai 哀[Ai1]",釐,"厂: cliff, 里: village",lí,level114
咨,consult,咨,"冫: ice, 欠: lack, 口: mouth",zī,level114
钉,nail/to pin up/to nail/to keep at sb/to follow closely,釘,"钅: gold, 一: one, 亅: hook",dīng,level114
焰,flame,焰,"火: fire, ⺈: unknown, 臼: mortar",yàn,level114
筋,muscle/tendon,筋,"⺮: bamboo, 月: moon, 力: power",jīn,level114
芒,"awn (of cereals)/arista (of grain)/tip (of a blade)/Miscanthus sinensis (type of grass)/variant of 邙, Mt Mang at Luoyang in Henan",芒,"艹: grass, 匸: hiding enclosure, 丶: dot",máng,level114
浸,to immerse/to soak/to steep/gradually,浸,"氵: water, 彐: snout, 冖: cover, 又: again",jìn,level114
呎,foot (unit of length equal to 0.3048 m)/old form of modern 英尺[ying1 chi3],呎,"口: mouth, 尸: corpse, ㇏: unknown",chǐ,level114
