人,"man/person/people/CL:個|个[ge4],位[wei4]",人,人: man,rén,level1
口,"mouth/classifier for things with mouths (people, domestic animals, cannons, wells etc)/classifier for bites or mouthfuls",口,口: mouth,kǒu,level1
一,"one/1/single/a (article)/as soon as/entire/whole/all/throughout/""one"" radical in Chinese characters (Kangxi radical 1)",一,一: one,yī,level1
又,(once) again/also/both... and.../and yet/(used for emphasis) anyway,又,又: again,yòu,level1
的,of/~'s (possessive particle)/(used after an attribute)/(used to form a nominal expression)/(used at the end of a declarative sentence for emphasis),的,"白: white, 勹: wrap, 丶: dot",de,level1
日,"sun/day/date, day of the month/abbr. for 日本 Japan",日,日: sun,rì,level1
土,Tu (ethnic group)/surname Tu,土,土: earth,tǔ,level1
白,surname Bai,白,白: white,bái,level1
木,surname Mu,木,木: tree,mù,level1
止,to stop/to prohibit/until/only,止,止: stop,zhǐ,level1
勺,"spoon/ladle/CL:把[ba3]/abbr. for 公勺[gong1 shao2], centiliter (unit of volume)",勺,"勹: wrap, 丶: dot",sháo,level1
大,big/huge/large/major/great/wide/deep/oldest/eldest,大,大: big,dà,level1
月,"moon/month/CL:個|个[ge4],輪|轮[lun2]",月,月: moon,yuè,level1
水,surname Shui,水,水: water,shuǐ,level1
手,"hand/(formal) to hold/person engaged in certain types of work/person skilled in certain types of work/personal(ly)/convenient/CL:雙|双[shuang1],隻|只[zhi1]",手,手: hand,shǒu,level1
不,(negative prefix)/not/no,不,"一: one, 丿: slash, 卜: divination",bù,level1
八,eight/8,八,八: eight,bā,level1
言,words/speech/to say/to talk,言,言: unknown,yán,level1
十,ten/10,十,十: ten,shí,level1
是,is/are/am/yes/to be,是,"日: sun, 一: one, 龰: unknown",shì,level1
咀,to chew/to masticate,咀,"口: mouth, 月: moon, 一: one",jǔ,level1
心,"heart/mind/intention/centre/core/CL:顆|颗[ke1],個|个[ge4]",心,心: heart,xīn,level2
寸,a unit of length/inch/thumb,寸,寸: inch,cùn,level2
也,surname Ye,也,"乚: second, ㇆: unknown, 丨: line",yě,level2
刀,surname Dao,刀,刀: knife,dāo,level2
了,(of eyes) bright/clear-sighted/to understand clearly,瞭,"㇇: unknown, 亅: hook",le,level2
女,female/woman/daughter,女,女: woman,nǚ,level2
力,surname Li,力,力: power,lì,level2
足,excessive,足,足: foot,zú,level2
有,to have/there is/there are/to exist/to be,有,"𠂇: unknown, 月: moon",yǒu,level2
子,"son/child/seed/egg/small thing/1st earthly branch: 11 p.m.-1 a.m., midnight, 11th solar month (7th December to 5th January), year of the Rat/Viscount, fourth of five orders of nobility 五等爵位[wu3 deng3 jue2 wei4]",子,子: child,zǐ,level2
在,(located) at/(to be) in/to exist/in the middle of doing sth/(indicating an action in progress),在,"𠂇: unknown, 亻: man, 土: earth",zài,level2
目,eye/item/section/list/catalogue/table of contents/order (taxonomy)/goal/name/title,目,目: eye,mù,level2
中,China/Chinese/surname Zhong,中,"口: mouth, 丨: line",zhōng,level2
三,surname San,三,"一: one, 二: two",sān,level2
王,surname Wang,王,王: jade,wáng,level2
我,I/me/my,我,"手: hand, 戈: halberd",wǒ,level2
儿,son,兒,"儿: son, legs",ér,level2
他,he or him/(used for either sex when the sex is unknown or unimportant)/(used before sb's name for emphasis)/(used as a meaningless mock object)/other/another,他,"亻: man, 乚: second, ㇆: unknown, 丨: line",tā,level2
上,see 上聲|上声[shang3 sheng1],上,"⺊: unknown, 一: one",shàng,level2
这,"this/these/(commonly pr. [zhei4] before a classifier, esp. in Beijing)",這,"辶: walk, 文: script",zhè,level2
竹,"bamboo/CL:棵[ke1],支[zhi1],根[gen1]",竹,竹: bamboo,zhú,level3
田,surname Tian,田,田: field,tián,level3
才,a moment ago/just now/(preceded by a clause of condition or reason) not until/(followed by a numerical clause) only,纔,"𠂇: unknown, ㇒: unknown",cái,level3
小,small/tiny/few/young,小,小: small,xiǎo,level3
生,"to be born/to give birth/life/to grow/raw, uncooked",生,生: life,shēng,level3
门,surname Men,門,门: gate,mén,level3
为,variant of 為|为[wei2]/as (i.e. in the capacity of)/to take sth as/to act as/to serve as/to behave as/to become/to be/to do,爲,"力: power, ⺀: unknown",wéi,level3
以,abbr. for Israel 以色列[Yi3 se4 lie4],以,"乚: second, 丶: dot, 人: man",yǐ,level3
来,to come/to arrive/to come round/ever since/next,來,"木: tree, 一: one, 丷: horns",lái,level3
之,"(possessive particle, literary equivalent of 的)/him/her/it",之,"王: jade, 丶: dot, 戈: halberd, ㇝: unknown",zhī,level3
自,from/self/oneself/since,自,自: self,zì,level3
二,two/2/stupid (Beijing dialect),二,二: two,èr,level3
个,variant of 個|个[ge4],箇,"人: man, 丨: line",gè,level3
火,surname Huo,火,火: fire,huǒ,level3
里,Li (surname),里,里: village,lǐ,level3
文,surname Wen,文,文: script,wén,level3
可,can/may/able to/to approve/to permit/to suit/(particle used for emphasis) certainly/very,可,"一: one, 亅: hook, 口: mouth",kě,level3
们,"plural marker for pronouns, and nouns referring to individuals",們,"亻: man, 门: gate",mén,level3
斤,catty/weight equal to 0.5 kg,斤,斤: axe,jīn,level3
夕,dusk/evening/Taiwan pr. [xi4],夕,夕: evening,xī,level3
到,to (a place)/until (a time)/up to/to go/to arrive,到,"至: arrive, 刂: knife",dào,level4
牛,surname Niu,牛,牛: cow,niú,level4
去,to go/to go to (a place)/to cause to go or send (sb)/to remove/to get rid of/(when used either before or after a verb) to go in order to do sth/to be apart from in space or time/(after a verb of motion indicates movement away from the speaker)/(used after certain verbs to indicate detachment or separation)/(of a time or an event etc) just passed or elapsed,去,"土: earth, 厶: private",qù,level4
说,"to canvass/to persuade/see 遊說|游说[you2 shui4], to canvass and 說客|说客[shui4 ke4], persuasive speaker",說,"讠: speech, 丷: horns, 口: mouth, 儿: son, legs",shuō,level4
贝,surname Bei,貝,贝: shell,bèi,level4
国,surname Guo,國,"囗: enclosure, 玉: jade",guó,level4
于,surname Yu,於,"干: dry, 亅: hook",yú,level4
立,surname Li,立,立: stand,lì,level4
和,"surname He/Japanese (food, clothes etc)",和,"禾: grain, 口: mouth",hé,level4
地,"-ly/structural particle: used before a verb or adjective, linking it to preceding modifying adverbial adjunct",地,"土: earth, 乚: second, ㇆: unknown, 丨: line",dì,level4
见,to see/to meet/to appear (to be sth)/to interview,見,见: see,jiàn,level4
工,work/worker/skill/profession/trade/craft/labor,工,工: work,gōng,level4
羊,surname Yang,羊,羊: sheep,yáng,level4
至,to arrive/most/to/until,至,至: arrive,zhì,level4
而,and/as well as/and so/but (not)/yet (not)/(indicates causal relation)/(indicates change of state)/(indicates contrast),而,而: and,ér,level4
其,his/her/its/theirs/that/such/it (refers to sth preceding it),其,"甘: sweet, 一: one, 八: eight",qí,level4
时,surname Shi,時,"日: sun, 寸: inch",shí,level4
几,almost,幾,几: table,jī,level4
者,"(after a verb or adjective) one who (is) .../(after a noun) person involved in .../-er/-ist/(used after a number or 後|后[hou4] or 前[qian2] to refer to sth mentioned previously)/(used after a term, to mark a pause before defining the term)/(old) (used at the end of a command)/(old) this",者,"耂: old, 日: sun",zhě,level4
广,surname Guang,廣,广: dotted cliff,guǎng,level4
牟,surname Mou,牟,"厶: private, 牛: cow",móu,level4
出,"to go out/to come out/to occur/to produce/to go beyond/to rise/to put forth/to happen/classifier for dramas, plays, operas etc",出,出: unknown,chū,level5
方,surname Fang,方,方: square,fāng,level5
道,"direction/way/road/path/principle/truth/morality/reason/skill/method/Dao (of Daoism)/to say/to speak/to talk/classifier for long thin stretches, rivers, roads etc/province (of Korea do 도, and formerly Japan dō)/CL:條|条[tiao2],股[gu3]",道,"辶: walk, 首: head",dào,level5
车,surname Che,車,车: cart,chē,level5
天,day/sky/heaven,天,"一: one, 大: big",tiān,level5
云,surname Yun/abbr. for Yunnan Province 雲南省|云南省[Yun2 nan2 sheng3],雲,"二: two, 厶: private",yún,level5
要,to demand/to request/to coerce,要,"覀: west, 女: woman",yào,level5
下,"down/downwards/below/lower/later/next (week etc)/second (of two parts)/to decline/to go down/to arrive at (a decision, conclusion etc)",下,"一: one, 卜: divination",xià,level5
衣,clothes/CL:件[jian4],衣,衣: clothes,yī,level5
厂,factory/yard/depot/workhouse/works/(industrial) plant,廠,厂: cliff,chǎng,level5
巴,Ba state during Zhou dynasty (in east of modern Sichuan)/abbr. for east Sichuan or Chongqing/surname Ba/abbr. for Palestine or Palestinian/abbr. for Pakistan,巴,"丨: line, No glyph available: unknown, 丨: line, 乚: second",bā,level5
西,the West/abbr. for Spain 西班牙[Xi1 ban1 ya2]/Spanish,西,西: west,xī,level5
用,to use/to employ/to have to/to eat or drink/expense or outlay/usefulness/hence/therefore,用,用: use,yòng,level5
你,"you (informal, as opposed to courteous 您[nin2])",你,"亻: man, ⺈: unknown, 小: small",nǐ,level5
旦,dawn/morning/day-break/day,旦,"日: sun, 一: one",dàn,level5
就,at once/right away/only/just (emphasis)/as early as/already/as soon as/then/in that case/as many as/even if/to approach/to move towards/to undertake/to engage in/to suffer/subjected to/to accomplish/to take advantage of/to go with (of foods)/with regard to/concerning,就,"亠: lid, 口: mouth, 小: small, 尢: lame, 丶: dot",jiù,level5
示,to show/to reveal,示,示: spirit,shì,level5
得,to obtain/to get/to gain/to catch (a disease)/proper/suitable/proud/contented/to allow/to permit/ready/finished,得,"彳: step, 日: sun, 一: one, 寸: inch",dé,level5
年,surname Nian,年,"丿: slash, 一: one, 十: ten, ㇗: unknown, 丨: line",nián,level5
犬,dog,犬,犬: dog,quǎn,level5
彷,seemingly,彷,"彳: step, 方: square",páng,level5
那,variant of 哪[na3],那,"㇆: unknown, 二: two, 丨: line, 阝: mound",nà,level6
己,"self/oneself/sixth of 10 heavenly stems 十天干/sixth in order/letter ""F"" or roman ""VI"" in list ""A, B, C"", or ""I, II, III"" etc/hexa",己,己: oneself,jǐ,level6
会,can/be possible/be able to/will/be likely to/be sure to/to assemble/to meet/to gather/to see/union/group/association/CL:個|个[ge4]/a moment (Taiwan pr. for this sense is [hui3]),會,"人: man, 二: two, 厶: private",huì,level6
对,couple/pair/to be opposite/to oppose/to face/versus/for/to/correct (answer)/to answer/to reply/to direct (towards sth)/right,對,"又: again, 寸: inch",duì,level6
此,this/these,此,"止: stop, 匕: spoon",cǐ,level6
后,back/behind/rear/afterwards/after/later,後,"⺁: unknown, 一: one, 口: mouth",hòu,level6
能,surname Neng,能,"厶: private, 月: moon, No glyph available: unknown",néng,level6
元,surname Yuan/the Yuan or Mongol dynasty (1279-1368),元,"二: two, 儿: son, legs",yuán,level6
丁,surname Ding,丁,"一: one, 亅: hook",dīng,level6
主,owner/master/host/individual or party concerned/God/Lord/main/to indicate or signify/trump card (in card games),主,"王: jade, 丶: dot",zhǔ,level6
正,first month of the lunar year,正,"一: one, 止: stop",zhèng,level6
着,(chess) move/trick/all right!/(dialect) to add,著,"羊: sheep, 目: eye",zhuó,level6
尔,thus/so/like that/you/thou,爾,"⺈: unknown, 小: small",ěr,level6
京,abbr. for Beijing/surname Jing/Jing ethnic minority,京,"亠: lid, 口: mouth, 小: small",jīng,level6
山,surname Shan,山,山: mountain,shān,level6
走,"to walk/to go/to run/to move (of vehicle)/to visit/to leave/to go away/to die (euph.)/from/through/away (in compound verbs, such as 撤走)/to change (shape, form, meaning)",走,走: run,zǒu,level6
行,a row/series/age order (of brothers)/profession/professional/relating to company,行,行: walk enclosure,háng,level6
尸,corpse,屍,尸: corpse,shī,level6
成,surname Cheng,成,"一: one, 丿: slash, ㇆: unknown, 戈: halberd",chéng,level6
事,"matter/thing/item/work/affair/CL:件[jian4],樁|桩[zhuang1]",事,"十: ten, 口: mouth, 丨: line, ⺺: unknown, 亅: hook",shì,level6
廿,"twenty (20), in a limited number of set expressions/also written using banker's character 念",廿,廿: unknown,niàn,level7
从,surname Cong,從,从: unknown,cóng,level7
所,"actually/place/classifier for houses, small buildings, institutions etc/that which/particle introducing a relative clause or passive/CL:個|个[ge4]",所,"戶: door, 斤: axe",suǒ,level7
金,surname Jin/surname Kim (Korean)/Jurchen Jin dynasty (1115-1234),金,金: unknown,jīn,level7
玉,jade,玉,玉: jade,yù,level7
家,surname Jia,家,"宀: roof, 豕: pig",jiā,level7
史,surname Shi,史,"口: mouth, 丨: line, 乂: unknown",shǐ,level7
过,surname Guo,過,"辶: walk, 寸: inch",guò,level7
巾,towel/general purpose cloth/women's headcovering (old)/Kangxi radical 50,巾,巾: turban,jīn,level7
只,"classifier for birds and certain animals, one of a pair, some utensils, vessels etc",隻,"口: mouth, 八: eight",zhī,level7
发,hair/Taiwan pr. [fa3],髮,"㇗: unknown, 丨: line, 丶: dot, 又: again",fā,level7
多,"many/much/a lot of/numerous/more/in excess/how (to what extent)/multi-/Taiwan pr. [duo2] when it means ""how""",多,多: unknown,duō,level7
户,a household/door/family,戶,户: door,hù,level7
兑,surname Dui,兌,"丷: horns, 口: mouth, 儿: son, legs",duì,level7
相,surname Xiang,相,"木: tree, 目: eye",xiāng,level7
头,head/hair style/the top/end/beginning or end/a stub/remnant/chief/boss/side/aspect/first/leading/classifier for pigs or livestock/CL:個|个[ge4],頭,"大: big, ⺀: unknown",tóu,level7
如,as/as if/such as,如,"女: woman, 口: mouth",rú,level7
开,"to open/to start/to turn on/to boil/to write out (a prescription, check, invoice etc)/to operate (vehicle)/abbr. for 開爾文|开尔文 degrees Kelvin",開,"一: one, 廾: two hands",kāi,level7
然,correct/right/so/thus/like this/-ly,然,"月: moon, 犬: dog, 灬: fire",rán,level7
古,surname Gu,古,"十: ten, 口: mouth",gǔ,level7
各,each/every,各,"夂: go, 口: mouth",gè,level8
作,to do/to grow/to write or compose/to pretend/to regard as/to feel/writings or works,作,"亻: man, 丿: slash, 一: one, 丨: line, 二: two",zuò,level8
分,to divide/to separate/to allocate/to distinguish (good and bad)/part or subdivision/fraction/one tenth (of certain units)/unit of length equivalent to 0.33 cm/minute/a point (in sports or games)/0.01 yuan (unit of money),分,"八: eight, 刀: knife",fēn,level8
首,"head/chief/first (occasion, thing etc)/classifier for poems, songs etc",首,首: head,shǒu,level8
本,"roots or stems of plants/origin/source/this/the current/root/foundation/basis/classifier for books, periodicals, files etc/originally",本,"木: tree, 一: one",běn,level8
青,nature's color/green or blue/greenish black/youth/young (of people)/abbr. for Qinghai province 青海,青,青: blue,qīng,level8
军,army/military/arms/CL:個|个[ge4],軍,"冖: cover, 车: cart",jūn,level8
页,page/leaf,頁,页: leaf,yè,level8
向,surname Xiang,向,"宀: roof, 口: mouth",xiàng,level8
与,"(same as 歟|欤, final particle expression doubt or surprise, similar to 吗 or 呢)",與,"No glyph available: unknown, 一: one",yǔ,level8
同,see 衚衕|胡同[hu2 tong4],衕,"冂: down box, 一: one, 口: mouth",tóng,level8
合,variant of 合[he2],閤,"人: man, 一: one, 口: mouth",hé,level8
米,surname Mi,米,米: rice,mǐ,level8
无,-less/not to have/no/none/not/to lack/un-,無,无: not,wú,level8
都,surname Du,都,"耂: old, 日: sun, 阝: mound",dū,level8
尤,surname You,尤,"尢: lame, 丶: dot",yóu,level8
长,length/long/forever/always/constantly,長,长: long,cháng,level8
入,to enter/to go into/to join/to become a member of/to confirm or agree with/abbr. for 入聲|入声[ru4 sheng1],入,入: enter,rù,level8
马,surname Ma/abbr. for Malaysia 馬來西亞|马来西亚[Ma3 lai2 xi1 ya4],馬,马: horse,mǎ,level8
士,surname Shi,士,士: scholar,shì,level8
将,will/shall/to use/to take/to checkmate/just a short while ago,將,"丬: half tree trunk, 小: small, 扌: hand, 亠: lid, 从: unknown, 十: ten",jiāng,level9
当,to be/to act as/manage/withstand/when/during/ought/should/match equally/equal/same/obstruct/just at (a time or place)/on the spot/right/just at,當,"⺌: small, 彐: snout",dāng,level9
么,exclamatory final particle,麼,"丿: slash, 厶: private",mó,level9
寺,buddhist temple/mosque/government office (old),寺,"土: earth, 寸: inch",sì,level9
经,surname Jing,經,"纟: silk, 龴: ma, 工: work",jīng,level9
法,France/French/abbr. for 法國|法国[Fa3 guo2],法,"氵: water, 土: earth, 厶: private",fǎ,level9
公,"public/collectively owned/common/international (e.g. high seas, metric system, calendar)/make public/fair/just/Duke, highest of five orders of nobility 五等爵位[wu3 deng3 jue2 wei4]/honorable (gentlemen)/father-in-law/male (animal)",公,"八: eight, 厶: private",gōng,level9
起,"to rise/to raise/to get up/to set out/to start/to appear/to launch/to initiate (action)/to draft/to establish/to get (from a depot or counter)/verb suffix, to start/(before place or time) starting from/classifier for occurrences or unpredictable events: case, instance/classifier for groups: batch, group",起,"走: run, 己: oneself",qǐ,level9
耳,ear/handle (archaeology)/and that is all (classical Chinese),耳,耳: ear,ěr,level9
好,good/well/proper/good to/easy to/very/so/(suffix indicating completion or readiness)/to be in love (e.g. 学姐，你跟他好了，就不怕代沟么？),好,"女: woman, 子: child",hǎo,level9
看,to look after/to take care of/to watch/to guard,看,"龵: hand, 目: eye",kàn,level9
且,and/moreover/yet/for the time being/to be about to/both (... and...),且,"月: moon, 一: one",qiě,level9
学,to learn/to study/science/-ology,學,"⺍: small, 冖: cover, 子: child",xué,level9
前,front/forward/ahead/ago/before/first/former/formerly/future/BC (e.g. 前293年),前,"丷: horns, 一: one, 月: moon, 刂: knife",qián,level9
进,"to advance/to enter/to come (or go) into/to receive or admit/to eat or drink/to submit or present/(used after a verb) into, in/to score a goal",進,"辶: walk, No glyph available: unknown, 二: two",jìn,level9
种,"seed/species/kind/type/classifier: type, kind, sort",種,"禾: grain, 口: mouth, 丨: line",zhǒng,level9
片,disc/sheet,片,片: slice,piàn,level9
还,surname Huan,還,"辶: walk, 一: one, 丿: slash, 卜: divination",huán,level9
因,cause/reason/because,因,"囗: enclosure, 大: big",yīn,level9
干,tree trunk/main part of sth/to manage/to work/to do/capable/cadre/to kill (slang)/to fuck (vulgar),幹,干: dry,gān,level9
欠,deficient/to owe/to lack/yawn,欠,欠: lack,qiàn,level10
知,to know/to be aware,知,"矢: arrow, 口: mouth",zhī,level10
定,to set/to fix/to determine/to decide/to order,定,"宀: roof, 一: one, 龰: unknown",dìng,level10
面,flour/noodles,麵,面: face,miàn,level10
由,to follow/from/it is for...to/reason/cause/because of/due to/to/to leave it (to sb)/by (introduces passive verb),由,"二: two, 丨: line, 凵: open box",yóu,level10
两,"two/both/some/a few/tael, unit of weight equal to 50 grams (modern) or 1⁄16 of a catty 斤[jin1] (old)",兩,"一: one, 从: unknown, 冂: down box",liǎng,level10
没,(negative prefix for verbs)/have not/not,沒,"氵: water, 殳: weapon",méi,level10
关,surname Guan,關,"丷: horns, 一: one, 大: big",guān,level10
使,to make/to cause/to enable/to use/to employ/to send/to instruct sb to do sth/envoy/messenger,使,"亻: man, 十: ten, 口: mouth, 丨: line, 乂: unknown",shǐ,level10
占,to observe/to divine,占,"⺊: unknown, 口: mouth",zhān,level10
兄,elder brother,兄,"口: mouth, 儿: son, legs",xiōng,level10
石,surname Shi,石,石: stone,shí,level10
部,"ministry/department/section/part/division/troops/board/classifier for works of literature, films, machines etc",部,"立: stand, 口: mouth, 阝: mound",bù,level10
高,surname Gao,高,高: tall,gāo,level10
舌,tongue,舌,舌: tongue,shé,level10
动,to use/to act/to move/to change/abbr. for verb 動詞|动词[dong4 ci2],動,"二: two, 厶: private, 力: power",dòng,level10
兴,surname Xing,興,"⺍: small, 一: one, 八: eight",xīng,level10
直,"surname Zhi/Zhi (c. 2000 BC), fifth of the legendary Flame Emperors 炎帝[Yan2 di4] descended from Shennong 神農|神农[Shen2 nong2] Farmer God",直,"十: ten, 目: eye, 一: one",zhí,level10
及,and/to reach/up to/in time for,及,"㇎: unknown, 丿: slash, ㇏: unknown",jí,level10
现,to appear/present/now/existing/current,現,"王: jade, 见: see",xiàn,level10
明,"Ming Dynasty (1368-1644)/surname Ming/Ming (c. 2000 BC), fourth of the legendary Flame Emperors, 炎帝[Yan2 di4] descended from Shennong 神農|神农[Shen2 nong2] Farmer God",明,"日: sun, 月: moon",míng,level11
些,some/few/several/measure word indicating a small amount or small number (greater than 1),些,"止: stop, 匕: spoon, 二: two",xiē,level11
尚,surname Shang,尚,"⺌: small, 冂: down box, 口: mouth",shàng,level11
网,net/network,網,网: net,wǎng,level11
理,texture/grain (of wood)/inner essence/intrinsic order/reason/logic/truth/science/natural science (esp. physics)/to manage/to pay attention to/to run (affairs)/to handle/to put in order/to tidy up,理,"王: jade, 里: village",lǐ,level11
样,manner/pattern/way/appearance/shape/CL:個|个[ge4],樣,"木: tree, 羊: sheep",yàng,level11
意,Italy/Italian/abbr. for 意大利[Yi4 da4 li4],意,"音: sound, 心: heart",yì,level11
化,variant of 花,化,"亻: man, 匕: spoon",huà,level11
东,surname Dong,東,"乚: second, 一: one, 小: small",dōng,level11
已,already/to stop/then/afterwards,已,已: unknown,yǐ,level11
想,to think/to believe/to suppose/to wish/to want/to miss,想,"木: tree, 目: eye, 心: heart",xiǎng,level11
实,real/true/honest/really/solid/fruit/seed/definitely,實,"宀: roof, 大: big, ⺀: unknown",shí,level11
把,to hold/to contain/to grasp/to take hold of/handle/particle marking the following noun as a direct object/classifier for objects with handle/classifier for small objects: handful,把,"扌: hand, 丨: line, No glyph available: unknown, 丨: line, 乚: second",bǎ,level11
丰,surname Feng,豐,"一: one, 二: two, 丨: line",fēng,level11
身,"body/life/oneself/personally/one's morality and conduct/the main part of a structure or body/pregnant/classifier for sets of clothes: suit, twinset/Kangxi radical 158",身,身: body,shēn,level11
音,sound/noise/note (of musical scale)/tone/news/syllable/reading (phonetic value of a character),音,音: sound,yīn,level11
太,highest/greatest/too (much)/very/extremely,太,"大: big, 丶: dot",tài,level11
但,but/yet/however/only/merely/still,但,"亻: man, 日: sun, 一: one",dàn,level11
未,"not yet/did not/have not/not/8th earthly branch: 1-3 p.m., 6th solar month (7th July-6th August), year of the Sheep",未,"木: tree, 一: one",wèi,level11
民,surname Min,民,"巳: unknown, ㇂: unknown, 一: one",mín,level11
四,four/4,四,"囗: enclosure, 儿: son, legs",sì,level11
半,half/semi-/incomplete/(after a number) and a half,半,"二: two, 丨: line, 丷: horns",bàn,level12
辛,surname Xin,辛,辛: bitter,xīn,level12
业,surname Ye,業,"No glyph available: unknown, 丷: horns, 一: one",yè,level12
安,surname An,安,"宀: roof, 女: woman",ān,level12
她,she,她,"女: woman, 乚: second, ㇆: unknown, 丨: line",tā,level12
先,early/prior/former/in advance/first,先,"⺧: cow, 儿: son, legs",xiān,level12
令,see 令狐[Ling2 hu2],令,"人: man, 丶: dot, 龴: ma",líng,level12
等,class/rank/grade/equal to/same as/to wait for/to await/et cetera/and so on/et al. (and other authors)/after/as soon as/once,等,"⺮: bamboo, 土: earth, 寸: inch",děng,level12
五,five/5,五,"一: one, 力: power, 一: one",wǔ,level12
勿,do not,勿,"勹: wrap, No glyph available: unknown",wù,level12
外,outside/in addition/foreign/external,外,"夕: evening, 卜: divination",wài,level12
第,"(prefix indicating ordinal number, e.g. first, number two etc)",第,"⺮: bamboo, 弓: bow, 丨: line, ㇒: unknown",dì,level12
曰,to speak/to say,曰,曰: say,yuē,level12
间,between/among/within a definite time or space/room/section of a room or lateral space between two pairs of pillars/classifier for rooms,間,"门: gate, 日: sun",jiān,level12
共,"common/general/to share/together/total/altogether/abbr. for 共產黨|共产党[gong4 chan3 dang3], Communist party",共,"艹: grass, 一: one, 八: eight",gòng,level12
取,to take/to get/to choose/to fetch,取,"耳: ear, 又: again",qǔ,level12
次,"next in sequence/second/the second (day, time etc)/secondary/vice-/sub-/infra-/inferior quality/substandard/order/sequence/hypo- (chemistry)/classifier for enumerated events: time",次,"冫: ice, 欠: lack",cì,level12
问,to ask,問,"门: gate, 口: mouth",wèn,level12
更,to change or replace/to experience/one of the five two hour periods into which the night was formerly divided/watch (e.g. of a sentry or guard),更,"一: one, 日: sun, 丨: line, 乂: unknown",gēng,level12
官,surname Guan,官,"宀: roof, 㠯: unknown",guān,level12
伞,umbrella/parasol/CL:把[ba3],傘,"人: man, 十: ten, 丷: horns",sǎn,level12
皮,surname Pi,皮,皮: skin,pí,level13
并,to combine/to amalgamate,併,"丷: horns, 一: one, 廾: two hands",bìng,level13
回,to curve/to return/to revolve,迴,回: unknown,huí,level13
少,few/little/lack,少,"小: small, 丿: slash",shǎo,level13
比,Belgium/Belgian/abbr. for 比利時|比利时[Bi3 li4 shi2],比,比: compare,bǐ,level13
它,it,它,"宀: roof, 匕: spoon",tā,level13
非,"abbr. for 非洲[Fei1 zhou1], Africa",非,非: wrong,fēi,level13
情,feeling/emotion/passion/situation,情,"忄: heart, 青: blue",qíng,level13
