人,"man/person/people/CL:個|个[ge4],位[wei4]",人,人: man,rén,level1
季,surname Ji,季,"禾: grain, 子: child",jì,level68
亿,100 million,億,"亻: man, ㇠: unknown",yì,level68
套,"cover/sheath/to encase/a case/to overlap/to interleave/bend (of a river or mountain range, in place names)/harness/classifier for sets, collections/tau (Greek letter Ττ)",套,"大: big, 镸: unknown",tào,level68
灾,disaster/calamity,災,"宀: roof, 火: fire",zāi,level68
泪,tears,淚,"氵: water, 目: eye",lèi,level68
忧,to worry/to concern oneself with/worried/anxiety/sorrow/a parent's funeral/inconvenienced by being orphaned,憂,"忄: heart, 尢: lame, 丶: dot",yōu,level68
喊,to yell/to shout/to call out for (a person),喊,"口: mouth, 厂: cliff, 戈: halberd, 一: one, 口: mouth",hǎn,level68
戴,surname Dai,戴,"土: earth, 戈: halberd, 田: field, 艹: grass, 一: one, 八: eight",dài,level68
纷,numerous/confused/disorderly,紛,"纟: silk, 八: eight, 刀: knife",fēn,level68
透,to penetrate/to pass through/thoroughly/completely/transparent/to appear/to show,透,"辶: walk, 禾: grain, ㇎: unknown, 丿: slash",tòu,level68
蒋,surname Jiang/refers to Chiang Kai-shek 蔣介石|蒋介石,蔣,"艹: grass, 丬: half tree trunk, 小: small, 扌: hand, 亠: lid, 从: unknown, 十: ten",jiǎng,level68
谘,to consult,諮,"讠: speech, 冫: ice, 欠: lack, 口: mouth",zī,level68
疏,surname Shu,疏,"⺪: bolt of cloth, 亠: lid, 厶: private, 儿: son, legs, 丨: line",shū,level69
浪,wave/breaker/unrestrained/dissipated,浪,"氵: water, 艮: stopping, 丶: dot",làng,level69
盟,"oath/pledge/union/to ally/league, a subdivision corresponding to prefecture in Inner Mongolia",盟,"日: sun, 月: moon, 皿: dish",méng,level69
薄,surname Bo,薄,"艹: grass, 氵: water, 十: ten, 用: use, 丶: dot, 寸: inch",báo,level69
殊,different/unique/special/very/(classical) to behead/to die/to cut off/to separate/to surpass,殊,"歹: death, 木: tree, 一: one, ㇒: unknown",shū,level69
丘,surname Qiu,丘,"斤: axe, 一: one",qiū,level69
阻,to hinder/to block/to obstruct,阻,"阝: mound, 月: moon, 一: one",zǔ,level69
竞,to compete/to contend/to struggle,競,"立: stand, 口: mouth, 儿: son, legs",jìng,level69
旗,"banner/flag/(in Qing times) refers to Manchurian ruling class, from 八旗[ba1 qi2] eight banners/administrative subdivision in inner Mongolia equivalent to 縣|县[xian4] county/CL:面[mian4]",旗,"方: square, 丿: slash, 一: one, 甘: sweet, 一: one, 八: eight",qí,level69
赖,surname Lai,賴,"木: tree, 口: mouth, ⺈: unknown, 贝: shell",lài,level69
闪,surname Shan,閃,"门: gate, 人: man",shǎn,level69
襄,surname Xiang,襄,"衣: clothes, 吅: unknown, No glyph available: unknown, 二: two, 一: one",xiāng,level69
姆,female tutor (old)/woman who looks after small children,姆,"女: woman, 母: do not",mǔ,level69
扩,enlarge,擴,"扌: hand, 广: dotted cliff",kuò,level69
驾,surname Jia,駕,"力: power, 口: mouth, 马: horse",jià,level69
混,confused/dirty/to mix/muddy/also written 渾|浑,混,"氵: water, 日: sun, 比: compare",hùn,level69
植,to plant,植,"木: tree, 十: ten, 目: eye, 一: one",zhí,level69
哲,philosophy/wise,哲,"扌: hand, 斤: axe, 口: mouth",zhé,level69
穷,exhausted/poor,窮,"穴: cave, 力: power",qióng,level69
俊,smart/eminent/handsome/talented,俊,"亻: man, 厶: private, 八: eight, 夂: go",jùn,level69
讬,to trust / to entrust / to be entrusted with / to act as trustee (nonstandard variant of 託｜托),託,"讠: speech, ㇒: unknown, 乚: second, 一: one",tuō,level69
埃,"dust/dirt/Angstrom or Ångström, unit of length equal to 10^-10 meters/phonetic ai or e/abbr. for Egypt 埃及[Ai1 ji2]",埃,"土: earth, 厶: private, 矢: arrow",āi,level70
伟,big/large/great,偉,"亻: man, 韦: tanned leather",wěi,level70
桥,bridge/CL:座[zuo4],橋,"木: tree, ㇒: unknown, 大: big, No glyph available: unknown",qiáo,level70
珍,precious thing/treasure/culinary delicacy/rare/valuable/to value highly,珍,"王: jade, 人: man, 彡: bristle",zhēn,level70
促,urgent/hurried/to urge/to promote/to urge haste/close/intimate,促,"亻: man, 足: foot",cù,level70
嘉,surname Jia,嘉,"士: scholar, 口: mouth, 丷: horns, 一: one, 力: power, 口: mouth",jiā,level70
烦,to feel vexed/to bother/to trouble/superfluous and confusing/edgy,煩,"火: fire, 页: leaf",fán,level70
眉,eyebrow/upper margin,眉,"丨: line, No glyph available: unknown, 丨: line, 目: eye",méi,level70
顷,variant of 傾|倾[qing1],頃,"匕: spoon, 页: leaf",qǐng,level70
惠,surname Hui,惠,"十: ten, 日: sun, 丨: line, No glyph available: unknown, 心: heart",huì,level70
墙,"wall/CL:面[mian4],堵[du3]",牆,"土: earth, 土: earth, 丷: horns, 回: unknown",qiáng,level70
径,footpath/track/diameter/straight/directly,徑,"彳: step, 龴: ma, 工: work",jìng,level70
购,to buy/to purchase,購,"贝: shell, 勹: wrap, 厶: private",gòu,level70
拍,to pat/to clap/to slap/to swat/to take (a photo)/to shoot (a film)/racket (sports)/beat (music),拍,"扌: hand, 白: white",pāi,level70
伸,to stretch/to extend,伸,"亻: man, 日: sun, 丨: line",shēn,level70
仲,surname Zhong,仲,"亻: man, 口: mouth, 丨: line",zhòng,level70
挂,to hang or suspend (from a hook etc)/to hang up (the phone)/to be worried or concerned/to make a phone call (topolect)/to register or record/to hitch/classifier for sets or clusters of objects,掛,"扌: hand, 圭: unknown",guà,level70
洗,to wash/to bathe/to develop (photo),洗,"氵: water, ⺧: cow, 儿: son, legs",xǐ,level70
贫,poor/inadequate/deficient/garrulous,貧,"八: eight, 刀: knife, 贝: shell",pín,level70
启,"Qi son of Yu the Great 禹[Yu3], reported founder of the Xia Dynasty 夏朝[Xia4 Chao2] (c. 2070-c. 1600 BC)",啟,"户: door, 口: mouth",qǐ,level70
籲,to implore,籲,"⺮: bamboo, 龠: flute, 頁: unknown",yù,level70
距,at a distance of/distance/to be apart,距,"⻊: foot, 匚: right open box, No glyph available: unknown",jù,level71
劝,to advise/to urge/to try to persuade/to exhort,勸,"又: again, 力: power",quàn,level71
盗,to steal/to rob/to plunder/thief/bandit/robber,盜,"冫: ice, 欠: lack, 皿: dish",dào,level71
努,to exert/to strive,努,"女: woman, 又: again, 力: power",nǔ,level71
桌,table,桌,"⺊: unknown, 日: sun, 木: tree",zhuō,level71
染,to dye/to catch (a disease)/to acquire (bad habits etc)/to contaminate/to add colour washes to a painting,染,"氵: water, 丿: slash, ㇈: unknown, 木: tree",rǎn,level71
署,office/bureau/to sign,署,"罒: net, 耂: old, 日: sun",shǔ,level71
厅,(reception) hall/office/living room,廳,"厂: cliff, 一: one, 亅: hook",tīng,level71
针,"needle/pin/injection/stitch/CL:根[gen1],支[zhi1]",針,"钅: gold, 十: ten",zhēn,level71
贸,commerce/trade,貿,"卯: unknown, 贝: shell",mào,level71
裁,to cut out (as a dress)/to cut/to trim/to reduce/to diminish/to cut back (e.g. on staff)/decision/judgment,裁,"土: earth, 戈: halberd, 衣: clothes",cái,level71
迅,rapid,迅,"辶: walk, ㇠: unknown, 十: ten",xùn,level71
迟,surname Chi,遲,"辶: walk, 尸: corpse, ㇏: unknown",chí,level71
沿,along/following (a line),沿,"氵: water, 几: table, 口: mouth",yán,level71
闭,to close/to stop up/to shut/to obstruct,閉,"门: gate, 𠂇: unknown, ㇒: unknown",bì,level71
侧,the side/to incline towards/to lean/inclined/lateral/side,側,"亻: man, 贝: shell, 刂: knife",cè,level71
拔,to pull up/to pull out/to draw out by suction/to select/to pick/to stand out (above level)/to surpass/to seize,拔,"扌: hand, 𠂇: unknown, 丶: dot, 又: again",bá,level71
贡,surname Gong,貢,"工: work, 贝: shell",gòng,level71
捕,to catch/to seize/to capture,捕,"扌: hand, 十: ten, 用: use, 丶: dot",bǔ,level71
唱,to sing/to call loudly/to chant,唱,"口: mouth, 昌: unknown",chàng,level71
彿,seemingly,彿,"彳: step, 弓: bow, No glyph available: unknown",fù,level71
措,to handle/to manage/to put in order/to arrange/to administer/to execute/to take action on/to plan,措,"扌: hand, 艹: grass, 一: one, 日: sun",cuò,level72
抽,to draw out/to pull out from in between/to remove part of the whole/(of certain plants) to sprout or bud/to whip or thrash,抽,"扌: hand, 二: two, 丨: line, 凵: open box",chōu,level72
课,"subject/course/CL: 門|门[men2]/class/lesson/CL:堂[tang2],節|节[jie2]/to levy/tax/form of divination",課,"讠: speech, 田: field, 木: tree",kè,level72
闹,noisy/cacophonous/to make noise/to disturb/to vent (feelings)/to fall ill/to have an attack (of sickness)/to go in (for some activity)/to joke,鬧,"门: gate, 亠: lid, 巾: turban",nào,level72
尾,tail/remainder/remnant/extremity/sixth of the 28 constellations/classifier for fish,尾,"尸: corpse, 毛: fur",wěi,level72
络,small net,絡,"纟: silk, 夂: go, 口: mouth",luò,level72
杯,"cup/classifier for certain containers of liquids: glass, cup",杯,"木: tree, 一: one, 丿: slash, 卜: divination",bēi,level72
衡,to weigh/weight/measure,衡,"行: walk enclosure, ⺈: unknown, 田: field, 大: big",héng,level72
翼,surname Yi/alternative name for 絳|绛[Jiang4] capital of the Jin State during the Spring and Autumn Period (770-475 BC),翼,"羽: feather, 田: field, 艹: grass, 一: one, 八: eight",yì,level72
稍,somewhat/a little,稍,"禾: grain, ⺌: small, 月: moon",shāo,level72
愈,to heal,癒,"人: man, 一: one, 月: moon, 刂: knife, 心: heart",yù,level72
蓝,surname Lan,藍,"艹: grass, 丨: line, 丨: line, 丿: slash, 一: one, 丶: dot, 皿: dish",lán,level72
颜,Japanese variant of 顏|颜[yan2],顔,"立: stand, 厂: cliff, 彡: bristle, 页: leaf",yán,level72
瑞,lucky/auspicious/propitious/rayl (acoustical unit),瑞,"王: jade, 山: mountain, 而: and",ruì,level72
壁,wall/rampart,壁,"尸: corpse, 口: mouth, 辛: bitter, 土: earth",bì,level72
售,to sell/to make or carry out (a plan or intrigue etc),售,"隹: short-tailed bird, 口: mouth",shòu,level72
倾,to overturn/to collapse/to lean/to tend/to incline/to pour out,傾,"亻: man, 匕: spoon, 页: leaf",qīng,level72
咱,see 咱[zan2],咱,"口: mouth, 自: self",zán,level72
逢,to meet by chance/to come across/to fawn upon,逢,"辶: walk, 夂: go, 一: one, 二: two, 丨: line",féng,level72
麦,surname Mai,麥,麦: wheat,mài,level72
蒐,madder (Rubia cordifolia)/to hunt for/to gather/to collect,蒐,"艹: grass, 鬼: ghost",sōu,level72
魔,devil,魔,"麻: hemp, 鬼: ghost",mó,level73
摩,to rub,摩,"麻: hemp, 手: hand",mó,level73
硬,hard/stiff/strong/firm/resolutely/doggedly/good (quality)/able (person),硬,"石: stone, 一: one, 日: sun, 丨: line, 乂: unknown",yìng,level73
牌,"mahjong tile/playing card/game pieces/signboard/plate/tablet/medal/CL:片[pian4],個|个[ge4],塊|块[kuai4]",牌,"片: slice, 冂: down box, 二: two, 丨: line, 丶: dot, 十: ten",pái,level73
恰,exactly/just,恰,"忄: heart, 人: man, 一: one, 口: mouth",qià,level73
魂,"soul/spirit/immortal soul, i.e. that can be detached from the body",魂,"二: two, 厶: private, 鬼: ghost",hún,level73
偷,to steal/to pilfer/to snatch/thief/stealthily,偷,"亻: man, 人: man, 一: one, 月: moon, 刂: knife",tōu,level73
紫,purple/violet/amethyst/Lithospermum erythrorhizon (flowering plant whose root provides red purple dye)/Japanese: murasaki,紫,"止: stop, 匕: spoon, 糸: unknown",zǐ,level73
菜,"dish (type of food)/vegetables/vegetable/cuisine/CL:盤|盘[pan2],道[dao4]",菜,"艹: grass, 爫: claw, 木: tree",cài,level73
莱,"name of weed plant (fat hen, goosefoot, pigweed etc)/Chenopodium album",萊,"艹: grass, 木: tree, 一: one, 丷: horns",lái,level73
涉,to wade/to be involved/to concern/to experience/to enter (classical),涉,"氵: water, 止: stop, 小: small, 丿: slash",shè,level73
驻,"to halt/to stay/to be stationed (of troops, diplomats etc)",駐,"马: horse, 王: jade, 丶: dot",zhù,level73
巷,lane/alley,巷,"艹: grass, 一: one, 八: eight, 巳: unknown",xiàng,level73
狱,prison,獄,"犭: dog, 讠: speech, 犬: dog",yù,level73
屈,surname Qu,屈,"尸: corpse, 出: unknown",qū,level73
吹,to blow/to play a wind instrument/to blast/to puff/to boast/to brag/to end in failure/to fall through,吹,"口: mouth, 欠: lack",chuī,level73
镜,mirror,鏡,"钅: gold, 音: sound, 儿: son, legs",jìng,level73
狗,"dog/CL:隻|只[zhi1],條|条[tiao2]",狗,"犭: dog, 勹: wrap, 口: mouth",gǒu,level73
融,harmonious/melt/mild,融,"鬲: cauldron, 虫: insect",róng,level73
拒,to resist/to repel/to refuse,拒,"扌: hand, 匚: right open box, No glyph available: unknown",jù,level73
蹟,variant of 跡|迹[ji4],蹟,"⻊: foot, 龶: unknown, 貝: unknown",jì,level73
渡,to cross/to pass through/to ferry,渡,"氵: water, 广: dotted cliff, 廿: unknown, 又: again",dù,level74
伐,to cut down/to fell/to dispatch an expedition against/to attack/to boast,伐,"亻: man, 戈: halberd",fá,level74
惧,to fear,懼,"忄: heart, 目: eye, 一: one, 八: eight",jù,level74
培,to cultivate/to earth up,培,"土: earth, 立: stand, 口: mouth",péi,level74
冠,surname Guan,冠,"冖: cover, 二: two, 儿: son, legs, 寸: inch",guān,level74
彻,thorough/penetrating/to pervade/to pass through,徹,"彳: step, 乚: second, 一: one, 刀: knife",chè,level74
骂,"to scold/to abuse/CL:通[tong4],頓|顿[dun4]",罵,"吅: unknown, 马: horse",mà,level74
盾,shield,盾,"⺁: unknown, 十: ten, 目: eye",dùn,level74
触,to touch/to make contact with sth/to stir up sb's emotions,觸,"角: horn, 虫: insect",chù,level74
订,to agree/to conclude/to draw up/to subscribe to (a newspaper etc)/to order,訂,"讠: speech, 一: one, 亅: hook",dìng,level74
怨,to blame/to complain,怨,"夕: evening, 乚: second, ㇆: unknown, 心: heart",yuàn,level74
搞,to do/to make/to go in for/to set up/to get hold of/to take care of,搞,"扌: hand, 高: tall",gǎo,level74
仰,surname Yang,仰,"亻: man, ㇒: unknown, ㇗: unknown, 卩: seal",yǎng,level74
恭,respectful,恭,"艹: grass, 一: one, 八: eight, 丨: line, ㇒: unknown, No glyph available: unknown",gōng,level74
隔,to separate/to partition/to stand or lie between/at a distance from/after or at an interval of,隔,"阝: mound, 鬲: cauldron",gé,level74
朗,clear/bright,朗,"丨: line, 彐: snout, 乚: second, 丶: dot, 丶: dot, 月: moon",lǎng,level74
详,detailed/comprehensive,詳,"讠: speech, 羊: sheep",xiáng,level74
译,to translate/to interpret,譯,"讠: speech, 又: again, 二: two, 丨: line",yì,level74
夷,"non-Han people, esp. to the East of China/barbarians/to wipe out/to exterminate/to tear down/to raze",夷,"大: big, 弓: bow",yí,level74
净,clean/completely/only,淨,"冫: ice, ⺈: unknown, ⺕: unknown, 亅: hook",jìng,level74
佈,variant of 布[bu4]/to announce/to spread,佈,"亻: man, 𠂇: unknown, 巾: turban",bù,level74
枝,"branch/classifier for sticks, rods, pencils etc",枝,"木: tree, 支: branch",zhī,level75
繁,"complicated/many/in great numbers/abbr. for 繁體|繁体[fan2 ti3], traditional form of Chinese characters",繁,"丿: slash, 一: one, 母: do not, ⺙: unknown, 糸: unknown",fán,level75
侠,knight-errant/brave and chivalrous/hero/heroic,俠,"亻: man, 人: man, 二: two, 丷: horns",xiá,level75
宰,to slaughter livestock/to govern or rule/to cheat customers/Imperial official in dynastic China,宰,"宀: roof, 辛: bitter",zǎi,level75
浮,to float/superficial/floating/unstable/movable/provisional/temporary/transient/impetuous/hollow/inflated/to exceed/superfluous/excessive/surplus,浮,"氵: water, 爫: claw, 子: child",fú,level75
奋,exert oneself,奮,"大: big, 田: field",fèn,level75
桑,surname Sang,桑,"叒: unknown, 木: tree",sāng,level75
汇,class/collection,彙,"氵: water, 匚: right open box",huì,level75
暂,temporary/Taiwan pr. [zhan4],暫,"车: cart, 斤: axe, 日: sun",zàn,level75
奖,prize/award/encouragement/CL:個|个[ge4],獎,"丬: half tree trunk, 夕: evening, 大: big",jiǎng,level75
幽,remote/hidden away/secluded/serene/peaceful/to imprison/in superstition indicates the underworld/ancient district spanning Liaonang and Hebei provinces,幽,"山: mountain, 𢆶: unknown",yōu,level75
耐,capable of enduring/able to tolerate/patient/durable/hardy/resistant,耐,"而: and, 寸: inch",nài,level75
朵,"flower/earlobe/fig. item on both sides/classifier for flowers, clouds etc",朵,"几: table, 木: tree",duǒ,level75
津,saliva/sweat/a ferry crossing/a ford (river crossing)/abbr. for Tianjin 天津,津,"氵: water, 聿: brush",jīn,level75
宪,statute/constitution,憲,"宀: roof, ⺧: cow, 儿: son, legs",xiàn,level75
奈,how can one help,奈,"大: big, 示: spirit",nài,level75
啦,(onomat.)/(phonetic),啦,"口: mouth, 扌: hand, 立: stand",lā,level75
签,"inscribed bamboo stick (used in divination, gambling, drawing lots etc)/small wood sliver/a label/a tag",籤,"⺮: bamboo, 人: man, 一: one, ⺍: small, 一: one",qiān,level75
颇,surname Po,頗,"皮: skin, 页: leaf",pō,level75
讯,to question/to ask/to interrogate/rapid/speedy/fast/news/information,訊,"讠: speech, ㇠: unknown, 十: ten",xùn,level75
惟,-ism/only,惟,"忄: heart, 隹: short-tailed bird",wéi,level75
彭,surname Peng,彭,"十: ten, 豆: bean, 彡: bristle",péng,level76
伴,partner/companion/comrade/associate/to accompany,伴,"亻: man, 二: two, 丨: line, 丷: horns",bàn,level76
豪,grand/heroic,豪,"亠: lid, 口: mouth, 冖: cover, 豕: pig",háo,level76
帐,covering veil/canopy/screen/tent/variant of 賬|账[zhang4],帳,"巾: turban, 长: long",zhàng,level76
昨,yesterday,昨,"日: sun, 丿: slash, 一: one, 丨: line, 二: two",zuó,level76
旋,to revolve/a loop/a circle,旋,"方: square, 丿: slash, 一: one, 疋: bolt of cloth",xuán,level76
籍,surname Ji,籍,"⺮: bamboo, 耒: plow, 艹: grass, 一: one, 日: sun",jí,level76
贺,surname He,賀,"力: power, 口: mouth, 贝: shell",hè,level76
郭,surname Guo,郭,"亠: lid, 口: mouth, 子: child, 阝: mound",guō,level76
幼,young,幼,"幺: short thread, 力: power",yòu,level76
惯,accustomed to/used to/indulge/to spoil (a child),慣,"忄: heart, 囗: enclosure, 十: ten, 贝: shell",guàn,level76
挑,to carry on a shoulder pole/to choose/to pick/to nitpick,挑,"扌: hand, 儿: son, legs, 冫: ice, No glyph available: unknown",tiāo,level76
鸡,fowl/chicken/CL:隻|只[zhi1],雞,"又: again, 鸟: bird",jī,level76
偶,accidental/image/pair/mate,偶,"亻: man, 冂: down box, 二: two, 丨: line, 禸: track",ǒu,level76
惜,pity/regret/to rue/to begrudge/Taiwan pr. [xi2],惜,"忄: heart, 艹: grass, 一: one, 日: sun",xī,level76
胆,the gall/the nerve/courage/guts/gall bladder,膽,"月: moon, 日: sun, 一: one",dǎn,level76
淡,insipid/diluted/weak/mild/light in color/tasteless/fresh/indifferent/nitrogen,淡,"氵: water, 炎: unknown",dàn,level76
沈,surname Shen/place name,沈,"氵: water, 巾: turban, 乚: second",shěn,level76
懂,to understand/to know,懂,"忄: heart, 艹: grass, ㇒: unknown, 十: ten, 里: village",dǒng,level76
凭,"to lean against/to rely on/on the basis of/no matter (how, what etc)/proof",憑,"亻: man, ㇒: unknown, 士: scholar, 几: table",píng,level76
暨,and/to reach to/the limits,暨,"丨: line, 彐: snout, 乚: second, 丶: dot, 旡: not, 日: sun, 一: one",jì,level76
辈,contemporaries/generation/lifetime,輩,"非: wrong, 车: cart",bèi,level77
岳,surname Yue,嶽,"斤: axe, 一: one, 山: mountain",yuè,level77
齿,tooth/CL:顆|颗[ke1],齒,齿: tooth,chǐ,level77
障,to block/to hinder/to obstruct,障,"阝: mound, 立: stand, 日: sun, 十: ten",zhàng,level77
倍,"(two, three etc) -fold/times (multiplier)/double/to increase or multiply",倍,"亻: man, 立: stand, 口: mouth",bèi,level77
仇,surname Qiu,仇,"亻: man, 丿: slash, ㇈: unknown",chóu,level77
萧,surname Xiao,蕭,"艹: grass, ⺺: unknown, No glyph available: unknown, 小: small",xiāo,level77
辩,to dispute/to debate/to argue/to discuss,辯,"辡: unknown, 讠: speech",biàn,level77
赋,poetic essay/taxation/to bestow on/to endow with,賦,"贝: shell, 一: one, 弋: shoot, 止: stop",fù,level77
抬,to lift/to raise/(of two or more persons) to carry,抬,"扌: hand, 厶: private, 口: mouth",tái,level77
仿,seemingly,彷,"亻: man, 方: square",fǎng,level77
债,debt/CL:筆|笔[bi3],債,"亻: man, 龶: unknown, 贝: shell",zhài,level77
赴,to go/to visit (e.g. another country)/to attend (a banquet etc),赴,"走: run, 卜: divination",fù,level77
汽,steam/vapor,汽,"氵: water, 气: steam",qì,level77
幕,curtain or screen/canopy or tent/headquarters of a general/act (of a play),幕,"艹: grass, 日: sun, 大: big, 巾: turban",mù,level77
播,to sow/to scatter/to spread/to broadcast/Taiwan pr. [bo4],播,"扌: hand, 釆: distinguish, 田: field",bō,level77
恢,to restore/to recover/great,恢,"忄: heart, 𠂇: unknown, 火: fire",huī,level77
零,zero/nought/zero sign/fractional/fragmentary/odd (of numbers)/(placed between two numbers to indicate a smaller quantity followed by a larger one)/fraction/(in mathematics) remainder (after division)/extra/to wither and fall/to wither,零,"雨: rain, 人: man, 丶: dot, 龴: ma",líng,level77
潮,tide/current/damp/moist/humid,潮,"氵: water, 十: ten, 日: sun, 十: ten, 月: moon",cháo,level77
刊,to print/to publish/publication/periodical,刊,"干: dry, 刂: knife",kān,level77
鑑,example/mirror/to view/reflection/to reflect/to inspect/to warn/(ancient bronze mirror),鑑,"金: unknown, 臣: minister, 丿: slash, 一: one, 丶: dot, 皿: dish",jiàn,level77
鸣,to cry (of birds),鳴,"口: mouth, 鸟: bird",míng,level78
悄,quiet/sad,悄,"忄: heart, ⺌: small, 月: moon",qiǎo,level78
撤,to remove/to take away/to withdraw,撤,"扌: hand, 亠: lid, 厶: private, 月: moon, ⺙: unknown",chè,level78
鼻,nose,鼻,鼻: nose,bí,level78
貌,appearance,貌,"豸: badger, 白: white, 儿: son, legs",mào,level78
箭,arrow/CL:支[zhi1],箭,"⺮: bamboo, 丷: horns, 一: one, 月: moon, 刂: knife",jiàn,level78
慈,compassionate/gentle/merciful/kind/humane,慈,"丷: horns, 一: one, 𢆶: unknown, 心: heart",cí,level78
荡,to wash/to squander/to sweep away/to move/to shake/dissolute/pond,蕩,"艹: grass, 氵: water, ㇎: unknown, No glyph available: unknown",dàng,level78
泛,to float/to be suffused with/general/extensive/non-specific/flood/pan- (prefix),泛,"氵: water, ㇒: unknown, 王: jade, 丶: dot, 戈: halberd, ㇝: unknown",fàn,level78
缩,to withdraw/to pull back/to contract/to shrink/to reduce/abbreviation/also pronounced [su4],縮,"纟: silk, 宀: roof, 亻: man, 一: one, 白: white",suō,level78
扶,to support with the hand/to help sb up/to support oneself by holding onto something/to help,扶,"扌: hand, 人: man, 二: two",fú,level78
欣,happy,欣,"斤: axe, 欠: lack",xīn,level78
赠,to give as a present/to repel/to bestow an honorary title after death (old),贈,"贝: shell, 丷: horns, 口: mouth, 丨: line, 丷: horns, 日: sun",zèng,level78
映,reflect/shine,映,"日: sun, 大: big, 冂: down box",yìng,level78
腰,waist/lower back/pocket/middle/loins,腰,"月: moon, 西: west, 女: woman",yāo,level78
晨,morning/dawn/daybreak,晨,"日: sun, 辰: morning",chén,level78
描,depict/to trace (a drawing)/to copy/to touch up,描,"扌: hand, 艹: grass, 田: field",miáo,level78
岩,variant of 岩[yan2],巖,"山: mountain, 石: stone",yán,level78
袋,a pouch/bag/sack/pocket,袋,"亻: man, 弋: shoot, 衣: clothes",dài,level78
胸,chest/bosom/heart/mind/thorax,胸,"月: moon, 勹: wrap, 凵: open box, 乂: unknown",xiōng,level78
慾,desire/appetite/passion/lust/greed,慾,"谷: valley, 欠: lack, 心: heart",yù,level78
池,surname Chi,池,"氵: water, 乚: second, ㇆: unknown, 丨: line",chí,level79
勤,diligent/industrious/hardworking/frequent/regular/constant,勤,"廿: unknown, 口: mouth, 丨: line, 王: jade, 力: power",qín,level79
祥,auspicious/propitious,祥,"礻: spirit, 羊: sheep",xiáng,level79
粗,coarse/rough/thick (for cylindrical objects)/unfinished/vulgar/rude/crude,粗,"米: rice, 月: moon, 一: one",cū,level79
裂,to split/to crack/to break open/to rend,裂,"歹: death, 刂: knife, 衣: clothes",liè,level79
荷,Holland/the Netherlands/abbr. for 荷蘭|荷兰[He2 lan2],荷,"艹: grass, 亻: man, 一: one, 亅: hook, 口: mouth",hé,level79
凉,"the five Liang of the Sixteen Kingdoms, namely: Former Liang 前涼|前凉 (314-376), Later Liang 後涼|后凉 (386-403), Northern Liang 北涼|北凉 (398-439), Southern Liang 南涼|南凉 (397-414), Western Liang 西涼|西凉 (400-421)",涼,"冫: ice, 亠: lid, 口: mouth, 小: small",liáng,level79
症,abdominal tumor,癥,"疒: sickness, 一: one, 止: stop",zhèng,level79
汗,"see 可汗[ke4 han2], 汗國|汗国[han2 guo2]",汗,"氵: water, 干: dry",hàn,level79
寄,to live (in a house)/to lodge/to mail/to send/to entrust/to depend,寄,"宀: roof, 大: big, 一: one, 亅: hook, 口: mouth",jì,level79
租,to hire/to rent/to charter/to rent out/to lease out/rent/land tax,租,"禾: grain, 月: moon, 一: one",zū,level79
爆,to explode or burst/to quick fry or quick boil,爆,"火: fire, 日: sun, 艹: grass, 一: one, 八: eight, 水: water",bào,level79
哀,"Ai (c. 2000 BC), sixth of legendary Flame Emperors 炎帝[Yan2 di4] descended from Shennong 神農|神农[Shen2 nong2] Farmer God, also known as Li 釐|厘[Li2]",哀,"衣: clothes, 口: mouth",āi,level79
润,smooth/moist,潤,"氵: water, 门: gate, 王: jade",rùn,level79
舒,surname Shu,舒,"人: man, 干: dry, 口: mouth, 龴: ma, ㇖: unknown, 亅: hook",shū,level79
腿,leg/CL:條|条[tiao2],腿,"月: moon, 辶: walk, 艮: stopping",tuǐ,level79
轰,explosion/bang/boom/rumble/to attack/to shoo away/to expel,轟,"车: cart, 双: unknown",hōng,level79
掩,to cover up/to close/to surprise,掩,"扌: hand, 大: big, 日: sun, 丨: line, 乚: second",yǎn,level79
祝,surname Zhu,祝,"礻: spirit, 口: mouth, 儿: son, legs",zhù,level79
